{
  "$schema": "https://cha2a.org/schemas/fixture-v1.json",
  "name": "cha2a/level-l4-two-verifiers",
  "description": "L3 + 2 独立已注册 verifier → L4",
  "fixtureType": "level",
  "spec": [
    {
      "id": "did:cha2a",
      "ref": "https://github.com/wwumit/did-method-cha2a/blob/main/did-method-cha2a.md",
      "section": "§4.6"
    }
  ],
  "verifierState": {
    "trustedRegistries": [
      "did:cha2a:registry:conformance-test"
    ],
    "registeredVerifiers": [
      "did:cha2a:verifier:verifier_a",
      "did:cha2a:verifier:verifier_b"
    ]
  },
  "input": {
    "metadata": {
      "contentIdentity": "sha256:abc123",
      "author": "did:cha2a:authority:example.com",
      "publisher": "did:cha2a:publisher:market"
    },
    "verifiedBy": [
      {
        "verifier": "did:cha2a:verifier:verifier_a",
        "method": "audit",
        "result": "passed",
        "at": "2026-08-30T00:00:00Z",
        "evidenceRef": "https://evidence.example.com/ev1"
      },
      {
        "verifier": "did:cha2a:verifier:verifier_b",
        "method": "audit",
        "result": "passed",
        "at": "2026-08-30T00:00:00Z",
        "evidenceRef": "https://evidence.example.com/ev2"
      }
    ],
    "revoked": false
  },
  "expected": {
    "verdict": "ACCEPT",
    "level": 4
  }
}
