{
  "$schema": "https://cha2a.org/schemas/fixture-v1.json",
  "name": "cha2a/normalization-uppercase-type",
  "description": "类型大写非法（语法强制小写）",
  "fixtureType": "normalization",
  "spec": [
    {
      "id": "did:cha2a",
      "ref": "https://github.com/wwumit/did-method-cha2a/blob/main/did-method-cha2a.md",
      "section": "§3.3"
    }
  ],
  "verifierState": {
    "trustedRegistries": [
      "did:cha2a:registry:conformance-test"
    ]
  },
  "input": {
    "did": "did:cha2a:AGENT:foo"
  },
  "expected": {
    "verdict": "REJECT"
  }
}
