{
  "$schema": "https://cha2a.org/schemas/fixture-v1.json",
  "name": "cha2a/resolve-known",
  "description": "已注册解析 ACCEPT",
  "fixtureType": "resolve",
  "spec": [
    {
      "id": "did:cha2a",
      "ref": "https://github.com/wwumit/did-method-cha2a/blob/main/did-method-cha2a.md",
      "section": "§4.2"
    }
  ],
  "verifierState": {
    "trustedRegistries": [
      "did:cha2a:registry:compliancehub.cn"
    ],
    "registeredResources": [
      "did:cha2a:agent:known_agent",
      "did:cha2a:skill:known_skill",
      "did:cha2a:org:known_org"
    ]
  },
  "input": {
    "did": "did:cha2a:agent:known_agent"
  },
  "expected": {
    "verdict": "ACCEPT"
  }
}
