{
  "$schema": "https://raw.githubusercontent.com/wwumit/cha2a-conformance/main/schemas/fixture-v1.json",
  "name": "cha2a/evidence-valid",
  "description": "字段完整 ACCEPT",
  "fixtureType": "evidence",
  "spec": [
    {
      "id": "did:cha2a",
      "ref": "https://github.com/wwumit/did-method-cha2a/blob/main/did-method-cha2a.md",
      "section": "§4.6"
    }
  ],
  "verifierState": {
    "trustedRegistries": [
      "did:cha2a:registry:conformance-test"
    ]
  },
  "input": {
    "subject": "did:cha2a:agent:x",
    "predicateType": "https://cha2a.org/predicate/identity-anchor/v1",
    "verifier": "did:cha2a:verifier:verifier_a",
    "result": "passed",
    "checkedAt": "2026-08-30T00:00:00Z",
    "evidenceRef": "https://evidence.example.com/ev"
  },
  "expected": {
    "verdict": "ACCEPT"
  }
}
