{
  "$schema": "https://cha2a.org/schemas/fixture-v1.json",
  "name": "cha2a/create-valid-verifier",
  "description": "verifier 合法注册",
  "fixtureType": "create",
  "spec": [
    {
      "id": "did:cha2a",
      "ref": "https://github.com/wwumit/did-method-cha2a/blob/main/did-method-cha2a.md",
      "section": "§4.1"
    }
  ],
  "verifierState": {
    "trustedRegistries": [
      "did:cha2a:registry:conformance-test"
    ],
    "registeredResources": [
      "did:cha2a:agent:known_agent",
      "did:cha2a:skill:known_skill",
      "did:cha2a:org:known_org"
    ]
  },
  "input": {
    "type": "verifier",
    "id": "new_verifier",
    "metadata": {
      "name": "new verifier",
      "author": "did:cha2a:authority:example.com"
    }
  },
  "expected": {
    "verdict": "ACCEPT"
  }
}
