{
  "$schema": "https://cha2a.org/schemas/fixture-v1.json",
  "name": "cha2a/norm-resource-id-uppercase-valid",
  "description": "resource-id 大写合法（case-preserving）",
  "fixtureType": "normalization",
  "spec": [
    {
      "id": "did:cha2a",
      "ref": "https://github.com/wwumit/did-method-cha2a/blob/main/did-method-cha2a.md",
      "section": "§3.4"
    }
  ],
  "verifierState": {
    "trustedRegistries": [
      "did:cha2a:registry:conformance-test"
    ]
  },
  "input": {
    "did": "did:cha2a:agent:Microsoft/vscode"
  },
  "expected": {
    "verdict": "ACCEPT"
  }
}
