{
  "$schema": "https://cha2a.org/schemas/fixture-v1.json",
  "name": "cha2a/did-syntax-valid-package",
  "description": "合法 package DID，ABNF 通过",
  "fixtureType": "did-syntax",
  "spec": [
    {
      "id": "did:cha2a",
      "ref": "https://github.com/wwumit/did-method-cha2a/blob/main/did-method-cha2a.md",
      "section": "§3.1"
    }
  ],
  "verifierState": {
    "trustedRegistries": [
      "did:cha2a:registry:conformance-test"
    ]
  },
  "input": {
    "did": "did:cha2a:package:conformance_valid_package"
  },
  "expected": {
    "verdict": "ACCEPT"
  }
}
