{
  "$schema": "https://cha2a.org/schemas/fixture-v1.json",
  "name": "cha2a/normalization-identity",
  "description": "无规范化：大小写保留、原样字节",
  "fixtureType": "normalization",
  "spec": [
    {
      "id": "did:cha2a",
      "ref": "https://github.com/wwumit/did-method-cha2a/blob/main/did-method-cha2a.md",
      "section": "§3.3"
    }
  ],
  "verifierState": {
    "trustedRegistries": [
      "did:cha2a:registry:conformance-test"
    ]
  },
  "input": {
    "did": "did:cha2a:agent:MyAgent_01",
    "expectNormalized": "did:cha2a:agent:MyAgent_01"
  },
  "expected": {
    "verdict": "ACCEPT"
  }
}
