{
  "$schema": "https://raw.githubusercontent.com/wwumit/cha2a-conformance/main/schemas/fixture-v1.json",
  "name": "cha2a/norm-resource-id-scoped-valid",
  "description": "scoped 名字节保持",
  "fixtureType": "normalization",
  "spec": [
    {
      "id": "did:cha2a",
      "ref": "https://github.com/wwumit/did-method-cha2a/blob/main/did-method-cha2a.md",
      "section": "§3.4"
    },
    {
      "id": "did:cha2a",
      "ref": "https://github.com/wwumit/did-method-cha2a/blob/main/did-method-cha2a.md",
      "section": "§3.1.1"
    }
  ],
  "verifierState": {
    "trustedRegistries": [
      "did:cha2a:registry:conformance-test"
    ]
  },
  "input": {
    "did": "did:cha2a:mcp_server:@modelcontextprotocol/server-filesystem"
  },
  "expected": {
    "verdict": "ACCEPT"
  }
}
